notice_date,event_number,reason,company,address,county,phone,business_type,affected,total_employees,layoff_date,dislocation,union,classification
10/1/2019,2019-0081,Plant Closing,Hotel Wales,"1295 Madison Avenue New York, NY 10128",New York County,(212) 683-3000,Hotel,42,42,12/31/2019,Economic,"New York Hotel & Motel Trades Council, AFL-CIO Local 6 Division A",Plant Closing
9/30/2019,2019-0080,Plant Closing,"57th Street, LLC d/b/a Kingside & The Roof","124 West 57th Street, Ground Floor & 29th Floor New York, NY 10019",New York County,(212) 750-6361 Ext,Hotel,107,107,1/1/2020,Sale of the hotel and lease was terminated,The employees are not represented by a union.,Plant Closing
10/1/2019,2019-0084,Plant Closing,"Isabella Visiting Care, Inc.","39 Broadway New York, NY 10006",New York County,(212) 356-5880,Licensed home care agency,569,569,12/31/2019,"Purchased by Bestcare, Inc.",1199 Service Employees International Union (SEIU),Plant Closing
10/1/2019,2019-0085,Plant Closing,"BINS Holdings, LLC fka BASIS Independent Schools, LLC (Manhattan)","795 Columbus Avenue New York, NY 10025",New York County,(480) 220-6081,"National network of PreK-12 private, secular schools",68,68,12/31/2019,"Acquired by Spring Education Group, Inc.",The employees are not represented by a union.,Plant Closing
9/26/2019,2019-0071,Plant Layoff,AllianceBernstein L.P. (Phase 7),"1345 Sixth Avenue New York, NY 10105",New York County,(212) 969-2135,Providing investment management and research services,51,1339,December,"Relocation of Corporate Headquarters to Nashville, Tennessee",The employees are not represented by a union.,Plant Layoff
9/27/2019,2019-0073,Plant Closing,"Merastar Insurance Company, a subsidiary of Kemper Corporation","5784 Widewaters Parkway DeWitt, NY 13214",Onondaga County,(570) 496-5646,Insurance,50,50,12/27/2019,Economic,The employees are not represented by a union.,Plant Closing
9/29/2019,2019-0074,Plant Closing,"Lane Bryant, Inc.","380 Fulton Street Brooklyn, NY 11201",Kings County,(614) 463-4851,Women's apparel,82,82,"12/29/2019,",Economic,"Retail, Wholesale and Department Store Union (RWDSU/UFCW) Local 338",Plant Closing
9/20/2019,2019-0070,Plant Layoff,"Crosstex International, Inc. (Cantel) Phase 2","10 Ranick Road Hauppauge, NY 11788",Suffolk County,(631) 582-6777,Dental equipment distribution and manufacturing,7,88,Separations,"Restructuring which will involve the relocation of certain dental equipment distribution and manufacturing operations to Rush, NY.",The employees are not represented by a union.,Plant Layoff
9/30/2019,2019-0076,Plant Unit Closing,Newsday LLC,"235 Pinelawn Road Melville, NY 11747",Suffolk County,(631) 843-2654,Newspaper print and distribution,1,708,This,Economic,The affected employee is not represented by a union.,Plant Unit Closing
10/1/2019,2019-0077,Plant Closing,AEG Presents (operator of PlayStation Theater aka The Best Buy Theater),"1515 Broadway New York, NY 10036",New York County,(212) 375-1200,Broadway Theater,62,62,The,"AEG Presents, the operator of PlayStation Theater aka The Best Buy Theater, will permanantly cease all of its operations of the theater.",International Alliance of Theatrical Stage Employees (IATSE) Local 1,Plant Closing
9/25/2019,2019-0079,Plant Closing,Empire State Brewing Corp. d/b/a Heartland Brewery,"350 Fifth Ave New York, NY 10118",New York County,(917) 999-6532,Restaurant,96,96,The,Economic,The employees are not represented by a union.,Plant Closing
10/1/2019,2019-0078,Plant Unit Closing,Edwards Vacuum LLC,"6416 Inducon Drive West Sanborn, NY 14132",Niagara County,(716) 990-6029,Appliance Manufacturer,65,104,Separations,Plant Manufacturing Unit Relocating,The employees are not represented by a union.,Plant Unit Closing
9/23/2019,2019-0069,Plant Closing,Concorde Medical Group PLLC,"316 East 30th Street, Floor 2 New York, NY 10116",New York County,(212) 481-4493,Home Health Care,115,115,12/31/2019,Economic,The employees are not represented by a union.,Plant Closing
9/20/2019,2019-0067,Plant Closing,"Pet Partners, LLC","5 Mountain Ledge Drive Wilton, NY 12831",Saratoga County,(518) 226-3508,Animal hospital,49,49,The,Economic,The employees are not represented by a union.,Plant Closing
9/9/2019,2019-0065,Plant Layoff,Home Box Office. Inc. (HBO Service Corp.),"30 Hudson Yards New York, NY 10001",New York County,(212) 512-5644,"American premium channel owned by the Home Box Office, Inc.",15,1176,Separations,Merger,The employees are not represented by a union.,Plant Layoff
9/20/2019,2018-0431,Plant Closing,American Technical Ceramics Corp,"One Norden Lane Huntington Station, NY 11746",Suffolk County,(631) 622-4772,Manufacturer of capacitors,24,157,The,Economic,The employees are not represented by a union.,Plant Closing
9/16/2019,2018-0419,Plant Closing,"WestRock CP, LLC","28 Park Drive Amsterdam, NY 12010",Montgomery County,(803) 367-1396,American corrugated packaging company.,52,52,Separations,Economic,"Amalgamated Lithographers of America, Local 259",Plant Closing
9/17/2019,2019-0064,Plant Closing,Sure Winner Foods,"102 Farrell Rd Syracuse, NY 13209",Onondaga County,(501) 305-9055,Dairy Product (except Dried or Canned) merchant Wholesalers,106,To,The,Business partner’s elimination of direct store deliveries,The employees are not represented by a union.,Plant Closing
9/15/2019,2019-0063,Plant Closing,Briad Restaurant Group LLC dba Fridays,"1780 East Gun Hill Rd Bronx, NY 10469",Bronx County,(973) 255-6187,Restaurant,62,62,12/22/2019,Economic,The employees are not represented by a union.,Plant Closing
9/11/2019,2018-0395,Plant Closing,"American Precision Industries, Inc.","45 Hazelwood Drive Amherst, NY 14228",Erie County,(630) 694-3339,Transmission Company,79,79,The,Economic,"International United Automobile, Aerospace and Agricultural Implement Workers of America (UAW) Local Union No. 1416",Plant Closing
9/11/2019,2019-0053,Plant Closing,"Premier Fixtures, LLC","400 Oser Avenue, Suite 350 Hauppauge, NY 11788",Suffolk County,(631) 236-4525 Ext,Custom architectural woodwork & millwork manufacturing,44,44,Separations,Economic,The employees are not represented by a union.,Plant Closing
May,2019-0062,Plant Layoff,"Goldman, Sachs & Co. LLC","200 West Street New York, NY 10282",New York County,(212) 357-2191,Global investment banking,2,8963,Separations,Economic,The employees are not represented by a union.,Plant Layoff
9/12/2019,2019-0052,Plant Closing,IntraPac International LLC,"4 Plant Street Plattsburgh, NY 12901",Clinton County,(704) 360-8918,Plastic Production Manufacturer,83,83,Employees,"Moving production to Mebane, NC facility",Teamsters Local 687,Plant Closing
9/10/2019,2019-0051,Plant Closing,F.G.W.J. Food Corp.,"427 East 14th Street New York, NY 10009",New York County,(212) 254-1586,Supermarket,73,73,12/10/2019,Economic,"United Food & Commercial Workers (UFCW) Local 342, and Retail, Wholesale and Department Store Union Local 338",Plant Closing
9/6/2019,2019-0049,Plant Layoff,Deutsche Bank,"60 Wall Street New York, NY 10005",New York County,(212) 250-9093,Banking,104,4800,Separations,Economic,The employees are not represented by a union.,Plant Layoff
8/30/2019,2019-0046,Plant Closing,Damiano Corp of South Sutphin dba McDonald's,"90-67 Sutphin Blvd. Jamaica, NY 11435",Queens County,(201) 794-7606 Ext. 7880,Restaurant,30,30,11/30/2019,Economic,The employees are not represented by a union.,Plant Closing
8/15/2019,2019-0050,Plant Layoff,"Home Box Office, Inc.","30 Hudson Yards New York, NY 10001",New York County,(212) 512-5644,American premium channel,3,0,11/15/2019,Merger,The employees are not represented by a union.,Plant Layoff
8/29/2019,2019-0047,Plant Layoff,IPT LLC dba Paylock,"3717 Irwin Ave Bronx, NY 10463",Bronx County,(908) 595-6900 Ext,Provides unique parking management products and services,15,15,Separations,Loss of contract with the city of New York,The employees are not represented by a union.,Plant Layoff
9/4/2019,2019-0044,Plant Closing,Johnson and Hoffman LLC,"40 Voice Road Carle Place, NY 11514",Nassau County,(816) 868-8690,Metal stamping service,63,63,The,Economic,The employees are not represented by a union.,Plant Closing
9/4/2019,2019-0043,Plant Closing,"WS Packaging Group, Inc.","29 Jetview Drive Rochester, NY 14624",Monroe County,(814) 493-3950,Produce high-quality label and packaging products,38,38,The,Economic,The employees are not represented by a union.,Plant Closing
8/29/2019,2019-0041,Plant Closing,Transform KM LLC (Kmart Unit #04034),"2803 Brewerton Rd Mattydale, NY 13211",Onondaga County,(847) 286-1427,Retail store,55,55,Separations,Economic,The employees are not represented by a union.,Plant Closing
8/29/2019,2019-0040,Plant Closing,Transform KM LLC (Kmart Unit #03415),"1001 Hertel Avenue Buffalo, NY 14216",Erie County,(847) 286-1427,Retail store,58,58,Separations,Economic,The employees are not represented by a union.,Plant Closing
8/29/2019,2019-0042,Plant Closing,Transform KM LLC (Kmart Unit #09414),"Rte 118 355 Downing Dr. Yorktown Heights, NY 10598",Westchester County,(847) 286-1427,Retail store,41,41,Separations,Economic,The employees are not represented by a union.,Plant Closing
8/29/2019,2019-0039,Plant Closing,Eastern Niagara Hospital,"2600 Williams St. Newfane, NY 14180",Niagara County,(716) 514-5542,Hospital,42,42,Affected,Economic,New York State Nurses Association (NYSNA) and Service Employees International Union (SEIU),Plant Closing
8/23/2019,2019-0038,Plant Closing,La Loggia LLC d/b/a Tarry Lodge Port Chester,"18 Mill Street Port Chester, NY 10573",Westchester County,(646) 556-5467,Restaurant,50,50,11/22/2019,Due to construction occurring on the premises.,The employees are not represented by a union.,Plant Closing
8/27/2019,2019-0037,Plant Closing,"MarineMax Services, Inc.","846 South Wellwood Ave. Lindenhurst, NY 11757",Suffolk County,(727) 400-3513,Recreational boat and yacht dealer,50,50,All,Due to construction occurring on the premises.,The employees are not represented by a union.,Plant Closing
8/19/2019,2019-0036,Plant Closing,Research Foundation of The City University of New York Mental Health Services Corps,"(various NYC sites) 230 West 41st Street New York, NY 10036",Kings County,(212) 417-8601,Home care services,265,265,Employment,"Transferring the Mental Health Services Corps from Hunter College, The City University of New York to the New York City Health and Hospitals Corporation.",The employees are not represented by a union.,Plant Closing
8/19/2019,2019-0035,Plant Layoff,"Metropolitan Jewish Home Care, Inc. dba MJHS Home Care","6323 Seventh Avenue Brooklyn, NY 11220",Kings County,(718) 491-7290,Home care services,28,170,11/18/2019,Economic,The employees are not represented by a union.,Plant Layoff
8/16/2019,2019-0034,Plant Closing,"Nestle USA, Inc. (and Nestle Dreyer's Ice Cream Company)","565 Broadhollow Road Farmingdale, NY 11735",Nassau County,(703) 682-7742,Packaged Foods,39,39,The,Shifting from direct-store delivery (DSD) to a warehouse distribution model for its frozen pizza and ice cream businesses.,The employees are not represented by a union.,Plant Closing
8/15/2019,2019-0032,Plant Closing,Transform KM LLC (Kmart Unit 04871),"2280 North Ocean Avenue Farmingville, NY 11738",Suffolk County,(847) 286-1427,Retail store,91,91,Separations,Economic,The employees are not represented by a union.,Plant Closing
8/16/2019,2019-0033,Plant Closing,"RNN News, LLC (Verizon Corporate Services Group Inc.'s FIOS1 News network)","800 Westchester Avenue Rye Brook, NY 10573",Westchester County,(914) 417-2700,Provides news programming and support services for Verizon Corporate Services Group Inc.’s FiOSl News network,145,145,11/15/2019,Expiration of contract,The employees are not represented by a union.,Plant Closing
8/1/2019,2019-0031,Plant Closing,The Service Companies at Innside New York,"70-74 Morningside Drive New York, NY 10027",New York County,(786) 237-2200,Housekeeping Services,66,66,Separations,Termination of housekeeping services agreement,The employees are not represented by a union.,Plant Closing
7/18/2019,2019-0025,Plant Closing,Spruce & Bond (HBG employees),"25 Bond Street New York, NY 10012",New York County,(646) 360-1413,"Wax, Laser, Brows in a hi-tech studio",6,0,Layoffs,Economic,The employees are not represented by a union.,Plant Closing
8/9/2019,2019-0030,Plant Closing,PAE Field Offices Support Services (FOSS),"Jacob Javits Federal Building, 26 Federal Plaza New York, NY 10278",New York County,(703) 656-7844,Support and professional services focused on national security customers.,97,97,Layoffs,Loss of contract,The employees are not represented by a union.,Plant Closing
8/6/2019,2018-0031,Plant Closing,CenterLight Certified Home Health Agency (CHHA),"1000 Gates Avenue (formerly located at 596 Prospect Place in Brooklyn, NY)  Brooklyn, NY 11221",Brooklyn County,(347) 920-7277,Home Health Care,105,105,Separations,Sale to Cassena Care,1199 SEIU United Healthcare Workers East and the New York State Nurses Association (NYSNA),Plant Closing
8/5/2019,2019-0014,Plant Closing,Community Development Institute Head Start,"216 Beach 87th Street Rockaway Beach, NY 11693",Queens County,603-427-0224,Pre-School,0,63,Due,Economic,The employees are not represented by a union.,Plant Closing
7/29/2019,2019-0022,Plant Layoff,L3 Harris Technologies,"600 Third Avenue New York, NY 10016",New York County,(212) 805-5318,A global defense technology leader,33,117,10/31/2019;,Economic,The employees are not represented by a union.,Plant Layoff
4/18/2019,2019-0024,Plant Layoff,"Goldman, Sachs & Co. LLC","200 West Street New York, NY 10282",New York County,(212) 357-219,A global defense technology leader,10,117,Employee,Economic,The employees are not represented by a union.,Plant Layoff
7/16/2019,2019-0012,Plant Layoff,"Turner Broadcasting System, Inc.","501 West 30th Street New York, NY 10001",New York County,(404) 878-7886,Company research & investing information,2,1725,Two,Economic,The employees are not represented by a union.,Plant Layoff
7/16/2019,2019-0017,Plant Closing,The Kildonan School,"425 Morse Hill Road Amenia, NY 12501",Dutchess County,(402) 649-2162,School,59,59,Separations,Economic,The employees are not represented by a union.,Plant Closing
7/29/2019,2019-0021,Plant Closing,"Crystal Run Health Plan, LLC (Phase 2)","109 Rykowski Lane Middletown, NY 10941",Orange County,(845) 703-6106,Health Plans,3,26,Separations,Economic,The employees are not represented by a union.,Plant Closing
7/29/2019,2019-0018,Plant Closing,Dean & DeLuca Inc.,"29-35 9th Avenue New York, NY 10014",New York County,(316) 821-3286,Gourmet foods and fine food gifts,35,35,Separations,Economic,The employees are not represented by a union.,Plant Closing
7/26/2019,2018-0441,Plant Closing,Dean & DeLuca Inc.,"1150 Madison Avenue New York, NY 10028",New York County,(316) 821-3286,Gourmet foods and fine food gifts,58,58,Separatons,Loss of lease for the premises,The employees are not represented by a union.,Plant Closing
7/19/2019,2019-0016,Plant Closing,Plated Fulfillment Center,"511 Barry Street Bronx, NY 10474",Bronx County,(631) 334-1937,Prepare and distribute meal kits,98,98,10/12/2019,"Relocation of operations to Totowa, New Jersey",The employees are not represented by a union.,Plant Closing
7/18/2019,2019-0015,Plant Layoff,DB USA Core Corporation (Deutsche Bank),"60 Wall Street New York, NY 10005",New York County,(212) 250-9093,Prepare and distribute meal kits,98,98,10/12/2019,"Relocation of operations to Totowa, New Jersey",The employees are not represented by a union.,Plant Layoff
7/10/2019,2018-0374,Plant Closing,CallVista LLC,"530 Summit Point Drive Henrietta, NY 14467",Monroe County,(443) 278-8596,Call center,27,27,Separations,Economic,The employees are not represented by a union.,Plant Closing
7/10/2019,2018-0376,Plant Closing,ClickSpark LLC,"530 Summit Point Drive Henrietta, NY 14467",Monroe County,(443) 278-8596,Internet marketing service,6,6,Separations,Economic,The employees are not represented by a union.,Plant Closing
7/16/2019,2019-0013,Plant Closing,Saks Fifth Avenue OFF 5th,"2100 Bartow Avenue Bronx, NY 10475",Bronx County,(609) 462-3260,Internet marketing service,6,6,Employee,Economic,The employees are not represented by a union.,Plant Closing
7/11/2019,2019-0011,Plant Closing,Transform SR LLC (Sears Full Line Store Unit 01624),"283 Platinum Ave Staten Island, NY 10314",Richmond County,(847) 286-1427,Retail Store,39,39,Separations,Economic,The employees are not represented by a union.,Plant Closing
7/10/2019,2019-0010,Plant Closing,"Amneal Pharmaceuticals, LLC","75 Adams Avenue Hauppauge, NY 11788",Suffolk County,(732) 645-3046,Pharmaceutical company,18,220,Separations,Economic,The employees are not represented by a union.,Plant Closing
7/12/2019,2018-0415,Plant Closing,"Dry Cycle Brands, LLC dba FlyCleaners","4700 Northern Blvd. Long Island City, NY 11101",Queens County,(646) 727-0819,"Pickup, delivery, dry cleaning, and laundry services.",71,71,Separations,Economic,The employees are not represented by a union.,Plant Closing
7/10/2019,2019-0009,Plant Layoff,Turner Broadcasting Sales Inc.,"30 Hudson Yards New York, NY 10001",New York County,(212) 275-6550,Company research & investing information,14,620,Eleven,Economic,The employees are not represented by a union.,Plant Layoff
7/8/2019,2019-0006,Plant Layoff,Barclays Services Corp. (Chief Operating Office and Functions  teams),"745 7th Avenue New York, NY 10019",New York County,(212) 526-5862,Company research & investing information,14,620,The,Economic,The employees are not represented by a union.,Plant Layoff
7/10/2019,2019-0007,Plant Layoff,AllianceBernstein L.P. (Phase 6),"1345 Sixth Avenue New York, NY 10105",New York County,(212) 969-2135,Company research & investing information,14,620,October,Economic,The employees are not represented by a union.,Plant Layoff
7/8/2019,2019-0005,Plant Unit Closing,"Deutsche Bank Securities  Inc., DB USA Core Corporation, and Deutsche Bank AG, New York Branch, and DB  USA Corp. (together, ""Deutsche Bank"")","60 Wall Street Brooklyn, NY 10005",New York County,(212) 250-9093,Company research & investing information,14,620,Separations,Economic,The employees are not represented by a union.,Plant Unit Closing
7/8/2019,2019-0004,Plant Closing,Empire Paratransit Corp.,"880 Alabama Avenue Brooklyn, NY 11207",Kings County,(718) 272-2060,Transportation service provider,325,325,The,"New York Transit Authority terminated Empire Paratransit Corp.'s contract as of July 2, 2019.","United Service Workers Union, Local 355",Plant Closing
7/1/2019,2019-0003,Plant Closing,Columbia University (Early Head Start Program),"4467 Broadway New York, NY 10040",New York County,(212) 305-0261,Transportation service provider,325,325,Separations,"New York Transit Authority terminated Empire Paratransit Corp.'s contract as of July 2, 2019.","1199, SEIU United  Healthcare Workers East (one employee is represented by the union)",Plant Closing
7/1/2019,2019-0002,Plant Closing,"Advance Transit Co., Inc.","1340 Lafayette Avenue Bronx, NY 10474",Bronx County,(718) 589-0015 ext. 311 / (212) 688-0888,Provides transportation throughout the five boroughs of NYC for people with disabilities.,143,143,Separations,Loss of contract with the Metropolitan Transit Authority – New York City Transit Authority,"International Brotherhood of Teamsters, Local 553",Plant Closing
6/28/2019,2018-0439,Plant Layoff,"Crosstex International, Inc. (Cantel)","10 Ranick Road Hauppauge, NY 11788",Suffolk County,(631) 582-6777,Dental equipment distribution and manufacturing,5,99,Separations,"Restructuring which will involve the relocation of certain dental equipment distribution and manufacturing operations to Rush, NY.",The employees are not represented by a union.,Plant Layoff
7/1/2019,2019-0001,Plant Layoff,JPMorgan Asset Management Holdings Inc. (JPMorgan Chase & Co.),"40 W. 57th Street New York, NY 10019",New York County,(212) 464-1953,Finance,52,106,9/30/2019,Restructuring,The employees are not represented by a union.,Plant Layoff
6/28/2019,2018-0436,Plant Closing,LimeLife USA LLC d/b/a Limelife by Alcone,"(Warehouse) 8 Westchester Plaza Elmsford, NY 10523",Westchester County,(646) 567-0066,"Retails chemical-free, natural, organic skin care, professional makeup",39,39,10/1/2019,Economic,The employees are not represented by a union.,Plant Closing
6/28/2019,2018-0437,Plant Closing,"Rare Chelsea Restaurant Group, LLC, aka Rare Bar & Grill Chelsea","152 West 26th Street New York, NY 10001",New York County,(646) 401-4727,Restaurant,79,79,9/30/2019,Economic,The employees are not represented by a union.,Plant Closing
Notices,2018-0434,Plant Layoff,"Warner Media, LLC (formerly Time Warner Inc.)","One Time Warner Center New York, NY 10019",New York County,(212) 484-6572,Media services,63,0,Separations,Merger,The employees are not represented by a union.,Plant Layoff
6/18/2019,2018-0433,Plant Closing,Banfi Products Corporation (Warehouse),"1111 Cedar Swamp Road Glen Head, NY 11545",Nassau County,(516) 686-2579,Wine and Distilled Alcoholic Beverage Merchant Wholesalers,1,64,The,Economic,The employees are not represented by a union.,Plant Closing
6/20/2019,2018-0429,Plant Closing,Four Seasons Restaurant,"42 East 49th Street New York, NY 10007",New York County,(212) 754-9494,Restaurant,85,85,6/11/2019,Economic,"UNITE HERE, Local 100",Plant Closing
6/21/2019,2018-0432,Plant Closing,"Ivy Enterprises, Inc.","3 Seaview Blvd Port Washington, NY 11050",Nassau County,(516) 625-9292,Restaurant,85,85,6/11/2019,Relocated to New Jersey,The employees are not represented by a union.,Plant Closing
6/18/2019,2018-0430,Plant Closing,"Kiss Products, Inc. (Warehouse)","57 Seaview Blvd Port Washington, NY 11050",Nassau County,(516) 625-9292,Restaurant,54,196,Separations,Relocated to New Jersey,The employees are not represented by a union.,Plant Closing
6/17/2019,2018-0427,Plant Layoff,"CONMED Corporation and Buffalo Filter, LLC","5900 Genesee Street Lancaster, NY 14086",Erie County,(574) 306-8710,Medical equipment manufacturer,24,82,The,Economic,The employees are not represented by a union.,Plant Layoff
6/17/2019,2017-0218,Plant Closing,Jabil Inc.,"2455 South Road, Bldg 002-2, Core Office 1 Poughkeepsie, NY 12601",Dutchess County,(901) 202-7440,Global manufacturing services company.,83,83,Termination,Economic,The affected workers are not represented by a union.,Plant Closing
6/17/2019,2018-0426,Plant Layoff,"Home Health Services of WJCS, Inc.","845 North Broadway White Plains, NY 10603",Westchester County,(914) 761-0600 Ext,Personal care aides and certified home health care aides,73,685,Separations,Reduction in home health aide services.,The employees are not represented by a union.,Plant Layoff
6/1/2019,2018-0423,Plant Closing,"M. Slavin & Sons, Ltd.","800 Food Center Drive, Unit 66 Bronx, NY 10474",Bronx County,(718) 732-4800 Ext,Wholesale distribution fresh fish,48,48,6/1/2019,Economic,United Seafood Workers Smoked Fish & Cannery Union Local 359 of Greater New York & Vicinity,Plant Closin
April,2018-0424,Plant Layoff,"Goldman, Sachs & Co. LLC","200 West Street New York, NY 10282",New York County,(212) 357-2191,Global investment banking,16,9352,Separations,Economic,The employees are not represented by a union.,Plant Layoff
6/13/2019,2018-0425,Plant Unit Closing,WNY Logistics LLC,"Warehouse 1587 Haskell Road Olean, NY 14760",Cattaraugus County,(603) 903-5148,"Warehouse - Frozen, parishable, and non-parishable foods",134,214,Separations,"Warehousing duties will be shifted to DuBois, PA.",The employees are not represented by a union.,Plant Unit Closing
6/12/2019,2018-0422,Plant Closing,Hillside Children's Center (Hillside Family of Agencies),"Varick Residential Treatment Campus 4887 State Route 96A Romulus, NY 14541",Seneca County,(585) 654-1391,Provider of care for youth and families with a wide range of emotional and behavioral challenges.,244,244,9/10/2019,Recognized national and statewide trends impacting the field of child-and-family services and the number of beds in residential treatment facilities.,The employees are not represented by a union.,Plant Closing
6/13/2019,2018-0421,Plant Closing,"Amsterdam Printing & Litho, Inc. (Web Graphics)","428 Corinth Road Queensbury, NY 12804",Warren County,(518) 954-2826,Graphic Design Services,88,88,Separations,Economic,The employees are not represented by a union.,Plant Closing
6/6/2019,2018-0418,Plant Layoff,AllianceBernstein L.P. (Phase 5),"1345 Sixth Avenue New York, NY 10105",New York County,(212) 969-6169,Providing investment management and research services,24,1461,Layoffs,"Relocation of Corporate Headquarters to Nashville, Tennessee",The employees are not represented by a union.,Plant Layoff
6/11/2019,2018-0420,Plant Closing,"John Hassall, LLC.","609 Cantiague Rock Road Westbury, NY 11590",Nassau County,(516) 334-6200,Manufacturing custom designed metal parts & fasteners,39,39,The,Economic,The employees are not represented by a union.,Plant Closing
6/3/2019,2018-0414,Plant Closing,Transform SR LLC (Full Line Store Unit 01733),"Rte 87 (NY St) & Cross Ct Pkwy Yonkers, NY 10704",Westchester County,(847) 286-1427,Retail Store,170,170,Employment,Economic,The employees are not represented by a union.,Plant Closing
6/5/2019,2018-0416,Plant Closing,"Lucky Strike Entertainment, LLC","One Crossgates Mall Road Albany, NY 12203",Albany County,(818) 933-3759,"Large  entertainment center with bowling, a game room, live music & a modern  American gastropub.",65,65,6/28/2019,Economic,The employees are not represented by a union.,Plant Closing
6/5/2019,2018-0417,Plant Closing,"Steiner Sports Memorabilia, Inc.","145 Huguenot Street New Rochelle, NY 10801",Westchester County,(914) 307-1085,Autographed  sports collectibles from the greatest teams and the best athletes in sports.,65,65,Separation,Economic,The employees are not represented by a union.,Plant Closing
