notice_date,event_number,reason,company,address,county,phone,business_type,affected,total_employees,layoff_date,dislocation,union,classification
2/6/2019,2018-0253,Plant Closing,"Eclipse Advantage, LLC","105 Rotterdam Industrial Park Schenectady, NY 12306",Schenectady County,(321) 473-7209,Unloading services with Union Pacific/Cold Connect.,62,62,May,Service contract cancelation with Union Pacific Cold Connect/Railex,The employees are not represented by a union.,Plant Closing
1/31/2019,2018-0251,Plant Closing,St. Joseph School,"25 Church Street Ronkonkoma, NY 11779",Suffolk County,(516) 280-4124,School,38,38,6/26/2019,Economic,The employees are not represented by a union.,Plant Closing
2/1/2019,2018-0247,Plant Layoff,AllianceBernstein L.P.,"1345 Sixth Avenue New York, NY 10105",New York City County,(212) 969-6169,Providing investment management and research services,36,1517,The,"Relocation of Corporate Headquarters to Nashville, Tennessee",The employees are not represented by a union.,Plant Layoff
1/31/2019,2018-0250,Plant Closing,All Saints Regional Catholic School,"12 Pearsall Avenue Glen Cove, NY 11542",Nassau County,(516) 280-4124,Providing investment management and research services,36,1517,The,"Relocation of Corporate Headquarters to Nashville, Tennessee",The employees are not represented by a union.,Plant Closing
1/31/2019,2018-0246,Plant Layoff,Eastman Kodak Company (Eastman Business Park),"1669 Lake Avenue Rochester, NY 14650",Monroe County,(585) 724-6615,Photographic equipment and Supplies,2,0,4/30/2019,Economic,The employees are not represented by a union.,Plant Layoff
1/28/2019,2018-0245,Plant Closing,ABM Aviation Inc.,"Delta Airlines at JFK International Airport. Terminals 2 and 4 Jamaica, NY 11430",Queens County,(718) 917-2079,Cabin cleaning services at Delta Airlines at JFK International Airport. Terminals 2 and 4,528,528,5/3/2019,Contractual Loss,SEIU Local 32BJ,Plant Closing
1/18/2019,"2018-0238, 2018-0239, 2018-0240",Plant Closings,Petland Discounts Inc.,Various Locations,"Nassau, Suffolk County",(631) 521-8326,Retail pet store,367,367,Separations,Economic,The employees are not represented by a union.,Plant Closings
1/15/2019,2018-0233,Plant Layoff,"Metropolitan Jewish Home Care, Inc. d\b\a MJHS Home Care","6323 Seventh Avenue Brooklyn, NY 11220",Kings County,(718) 491-7290,Home care services,112,246,April,Economic,The employees are not represented by a union.,Plant Layoff
1/17/2019,2018-0236,Plant Closing,Centerplate at the New York Racing Association (NYRA),"Saratoga Racetracks 267 Union Avenue Saratoga Springs, NY 12866",Saratoga County,(864) 248-2042,Hospitality services,441,441,The,Contract Loss,"New York Hotel & Motel Trades Council, AFL-CIO",Plant Closing
1/25/2019,2018-0241,Plant Layoff,SAE Sun and Earth Energy Inc.,"444 Washington Street Rensselaer, NY 12144",Rensselaer County,(518) 444-2044,Hospitality services,441,441,The,Contract Loss,The employees are not represented by a union.,Plant Layoff
1/25/2019,2018-0241,Plant Layoff,"Monolith Solar Associates, LLC","444 Washington Street Rensselaer, NY 12144",Rensselaer County,(518) 444-2044,Hospitality services,441,441,The,Contract Loss,The employees are not represented by a union.,Plant Layoff
1/25/2019,2018-0243,Plant Layoff,"Monticello Raceway Management, Inc. (Casino)","204 State Route 17B Monticello, NY 12701",Sullivan County,(845) 428-7200 Ext. 1460,Hospitality services,441,441,The,Contract Loss,"New York Hotel & Motel Trades Council,  AFL-CIO - 92 employees; the Laborers' International Union of North America,  Local 17, AFL-CIO- 13 employees; the International Union of Operating  Engineers, Local 825 – 5 employees; and the Northeast Regional Council of  Carpenters, United Brotherhood of Carpenters and Joinders of America- 2  employees.",Plant Closing
1/18/2019,2018-0232,Plant Closing,"Third & 50, LLC (aka Dos Caminos)","825 Third Avenue New York, NY 10022",New York County,(718) 386-7187,Restaurant,100,100,Separation,Lease expiration,The employees are not represented by a union.,Plant Closing
1/18/2019,2018-0234,Plant Closing,"Mercedes Distribution Center, Inc.","63 Flushing Avenue, Unit 340 Brooklyn, NY 11205",Kings County,(718) 534-3003,Warehouse Distribution service,100,100,The,Economic,"International Brotherhood of Teamsters, Local 553",Plant Closing
1/18/2019,2018-0231,Plant Closing,Macy's,"7000 Fashion Drive Nanuet, NY 10954",Rockland County,(646) 787-4816,Retail Store,92,92,Separations,Economic,The employees are not represented by a union.,Plant Closing
1/16/2019,2018-0230,Plant Layoff,TheaterMania.com,"550 7th Ave New York, NY 10018",New York County,(416)-687-2062,"Offers directory of shows, tickets, and discounts across the U.S.",17,81,Separations,Economic,The employees are not represented by a union.,Plant Layoff
1/7/2018,2018-0225,Plant Layoff,Senior Rehab Solutions (Norwegian Home and Health Center),"1250 67th Street Brooklyn, NY 11219",Kings County,(214) 252-7653,Nursing home,22,22,The,Economic,The employees are not represented by a union.,Plant Layoff
1/16/2019,2018-0229,Plant Closing,"CareConnect Insurance Company, Inc.","2200 Northern Boulevard East Hills, NY 11548",Nassau County,(516) 405-7925,Health insurance market,46,40,Phase,Economic,The employees are not represented by a union.,Plant Closing
1/10/2019,2018-0226,Plant Closing,"Kohl's Department Stores, Inc. (Store #1328)","6135 Junction Blvd. Rego Park, NY 11374",Queens County,(262) 703-7000,Retail store,107,107,4/13/2019,Economic,The employees are not represented by a union.,Plant Closing
1/16/2019,2018-0177,Plant Closing,Thomson Reuters Corporation,"(Operations and Enablement - Technology, Content Operations & Legal Editorial) 50 East Broad Street Rochester, NY 14614",Monroe County,(651) 848-3154,Multinational mass media and information firm,207,327,Layoffs,Economic,The employees are not represented by a union.,Plant Closing
1/15/2019,2018-0228,Plant Closing,General Motors LLC (Cadillac New York Headquarters),"330 Hudson Street New York, NY 10013",New York County,(313) 407-9929,Automobile manufacturer and retailer.,97,97,Separations,Economic,The employees are not represented by a union.,Plant Closing
1/11/2019,2018-0223,Plant Closing,"Calvin Klein, Inc.","(Madison Collection Store) 654 Madison Avenue New York, NY 10065",New York County,(212) 292-9785,Clothing Retail store,29,29,Three,Economic,The employees are not represented by a union.,Plant Closing
1/10/2019,2018-0222,Plant Closing,Aveda Institute Inc.,"(Aveda Institute New York School) 233 Spring Street New York, NY 10013",New York County,(212) 230-6181,Beauty school,48,48,Separations,Sale of the Aveda Institute New York School,The employees are not represented by a union.,Plant Closing
1/7/2019,2018-0218,Plant Closing,"Independence Care System, Inc. (ICS)","257 Park Avenue South New York, NY 10010",New York County,(212) 584-2580,Managed Long-Term Care (MLTC),97,97,4/7/2019,"Due to changes in its business, ICS will be closing its MLTC line of business.",The employees are not represented by a union.,Plant Closing
1/9/2019,2018-0221,Plant Closing,"Pfizer, Inc.","64 Maple Street Rouses Point, NY 12979",Clinton County,(212) 733-2110,Pharmaceuticals (production),6,12,Separations,Economic,International Chemical Workers Union/UFCW Local 95c,Plant Closing
1/7/2019,2018-0216,Plant Closing,"AT&T Services, Inc.","(Billing Inquiry Call Center Operations) 250 South Clinton Street Syracuse, NY 13202",Onondaga County,(313) 421-9648,Telecommunications (Billing Inquiry Call Center Operations),155,155,4/12/2019,"Transfer of operations to Orange Park, Florida",Communications Workers of America,Plant Closing
1/7/2019,2018-0217,Plant Closing,"Lighthouse Management Services, LLC","300 Clinton Square Rochester, NY 14604",Monroe County,(585) 246-4151,Property management company,48,48,Layoffs,Termination of property management contracts,The employees are not represented by a union.,Plant Closing
1/6/2019,2018-0215,Plant Closing,Morrison Healthcare Food and Nutrition Services at Erie Medical Center,"462 Grider Street Buffalo, NY 14215",Erie County,(914) 426-8240,National food and nutrition services company,172,172,4/6/2019,Contractual Loss,"CSEA Local 1000, AFSCME, AFL-CIO",Plant Closing
12/27/2018,2018-0213,Plant Closing,Kmart Store (Unit 07677),"121 Bolivar Road Wellsville, NY 14895",Allegany County,(847) 286-1427,Retail Store,88,88,Employment,Economic,The employees are not represented by a union.,Plant Closing
12/27/2018,2018-0214,Plant Closing,Kmart Store (Unit 04928),"49 Dix Avenue Ext. Queensbury, NY 12804",Warren County,(847) 286-1427,Retail Store,60,60,Employment,Economic,The employees are not represented by a union.,Plant Closing
12/27/2018,2018-0211,Plant Closing,"Sears, Roebuck and Co. Full Line Store (Unit 01894)","10 Miracle Mile Dr. Rochester, NY 14623",Monroe County,(847) 286-1427,Retail Store,70,70,Employment,Economic,The employees are not represented by a union.,Plant Closing
12/28/2018,2018-0210,Plant Closing,"St. Lawrence Health Alliance, Inc.","3 Lyon Place Ogdensburg, NY 13669",St. Lawrence County,(315) 713-6612,Healthcare Services,72,72,3/31/2019,The Claxton-Hepburn Medical Center will assume operations and all employees will be offered employment.,The employees are not represented by a union.,Plant Closing
